{
  "formatVersion": 1,
  "meta": { "name": "Zombie Defense", "gameType": "zombie", "orientation": "landscape" },
  "settings": { "locale": "fa", "fps": 60 },
  "scenes": [
    { "id": "s1", "name": "Bunker", "entry": true, "background": { "color": "#1A0B0B" }, "objectIds": ["barricade", "turret", "zombie1", "wave_hud", "fire_btn"], "transitions": [] }
  ],
  "objects": [
    { "id": "barricade", "sceneId": "s1", "kind": "rect", "visible": true, "layer": 1, "components": { "Transform": { "x": 220, "y": 80, "w": 20, "h": 320, "rotation": 0, "opacity": 1 } } },
    { "id": "turret", "sceneId": "s1", "kind": "rect", "visible": true, "layer": 2, "components": { "Transform": { "x": 100, "y": 200, "w": 60, "h": 60, "rotation": 0, "opacity": 1 } } },
    { "id": "zombie1", "sceneId": "s1", "kind": "circle", "visible": true, "layer": 2, "components": { "Transform": { "x": 620, "y": 210, "w": 50, "h": 50, "rotation": 0, "opacity": 1 } } },
    { "id": "wave_hud", "sceneId": "s1", "kind": "text", "visible": true, "layer": 3, "components": { "Transform": { "x": 30, "y": 30, "w": 260, "h": 40 }, "Text": { "text": "موج زامبی: ۱", "size": 24, "color": "#EF4444" } } },
    { "id": "fire_btn", "sceneId": "s1", "kind": "button", "visible": true, "layer": 3, "components": { "Transform": { "x": 60, "y": 380, "w": 160, "h": 60 }, "Button": { "label": "دفاع موشکی", "eventId": "ev_defend", "enabled": true } } }
  ],
  "events": [
    { "id": "ev_defend", "trigger": { "type": "tap", "target": "fire_btn" }, "actions": [ { "capability": "CAP-0020", "params": { "variable": "kills", "amount": 1 } } ] }
  ],
  "variables": [
    { "name": "kills", "type": "number", "initial": 0 }
  ],
  "assets": []
}