{
  "formatVersion": 1,
  "meta": { "name": "Dodge", "gameType": "runner", "orientation": "landscape" },
  "settings": { "locale": "fa" },
  "scenes": [
    { "id": "s1", "name": "Run", "entry": true, "background": { "color": "#0B0B0F" }, "objectIds": [], "transitions": [] }
  ],
  "objects": [
    { "id": "hero", "sceneId": "s1", "kind": "rect", "visible": true, "layer": 2, "components": { "Transform": { "x": 100, "y": 300, "w": 60, "h": 60 }, "Health": { "max": 3, "current": 3 } } },
    { "id": "rock", "sceneId": "s1", "kind": "circle", "visible": true, "layer": 1, "components": { "Transform": { "x": 700, "y": 300, "w": 60, "h": 60 } } },
    { "id": "hint", "sceneId": "s1", "kind": "text", "visible": true, "layer": 0, "components": { "Transform": { "x": 200, "y": 60, "w": 400, "h": 50 }, "Text": { "text": "Tap to jump (dodge)", "size": 28, "color": "#FFFFFF" } } }
  ],
  "events": [
    { "id": "evBoot", "trigger": { "type": "start" }, "actions": [ { "capability": "CAP-0011", "params": { "name": "spawn", "durationMs": 1500, "repeat": true } } ] },
    { "id": "evSpawn", "trigger": { "type": "timer", "name": "spawn" }, "actions": [ { "capability": "CAP-0001", "params": { "target": "rock", "dx": -650, "dy": 0, "durationMs": 1400 } }, { "capability": "CAP-0012", "params": { "durationMs": 1450, "then": [ { "capability": "CAP-0006", "params": { "target": "rock", "x": 700, "y": 300 } } ] } } ] },
    { "id": "evJump", "trigger": { "type": "tap" }, "actions": [ { "capability": "CAP-0001", "params": { "target": "hero", "dx": 0, "dy": -180, "durationMs": 250 } }, { "capability": "CAP-0012", "params": { "durationMs": 260, "then": [ { "capability": "CAP-0001", "params": { "target": "hero", "dx": 0, "dy": 180, "durationMs": 250 } } ] } } ] }
  ],
  "variables": [ { "name": "score", "type": "number", "initial": 0 } ],
  "assets": []
}
