{
  "formatVersion": 1,
  "meta": { "name": "Idle Tycoon", "gameType": "idle", "orientation": "portrait" },
  "settings": { "locale": "fa", "fps": 60 },
  "scenes": [
    { "id": "s1", "name": "Factory", "entry": true, "background": { "color": "#0B1612" }, "objectIds": ["gold_title", "click_generator", "upgrade_btn"], "transitions": [] }
  ],
  "objects": [
    { "id": "gold_title", "sceneId": "s1", "kind": "text", "visible": true, "layer": 1, "components": { "Transform": { "x": 40, "y": 80, "w": 400, "h": 60 }, "Text": { "text": "سکه: ۰", "size": 36, "color": "#F59E0B" } } },
    { "id": "click_generator", "sceneId": "s1", "kind": "button", "visible": true, "layer": 2, "components": { "Transform": { "x": 90, "y": 260, "w": 300, "h": 140 }, "Button": { "label": "تولید طلا", "eventId": "ev_mine", "enabled": true } } },
    { "id": "upgrade_btn", "sceneId": "s1", "kind": "button", "visible": true, "layer": 2, "components": { "Transform": { "x": 90, "y": 440, "w": 300, "h": 70 }, "Button": { "label": "ارتقای کارخانه", "eventId": "ev_upgrade", "enabled": true } } }
  ],
  "events": [
    { "id": "ev_mine", "trigger": { "type": "tap", "target": "click_generator" }, "actions": [ { "capability": "CAP-0020", "params": { "variable": "gold", "amount": 1 } } ] },
    { "id": "ev_upgrade", "trigger": { "type": "tap", "target": "upgrade_btn" }, "actions": [ { "capability": "CAP-0020", "params": { "variable": "gold", "amount": 10 } } ] }
  ],
  "variables": [
    { "name": "gold", "type": "number", "initial": 0 }
  ],
  "assets": []
}