{
  "formatVersion": 1,
  "meta": { "name": "Shooter", "gameType": "shooter", "orientation": "landscape" },
  "settings": { "locale": "fa", "fps": 60 },
  "scenes": [
    { "id": "s1", "name": "Arena", "entry": true, "background": { "color": "#0D1117" }, "objectIds": ["ship", "target1", "target2", "score_text", "shoot_btn"], "transitions": [] }
  ],
  "objects": [
    { "id": "ship", "sceneId": "s1", "kind": "rect", "visible": true, "layer": 2, "components": { "Transform": { "x": 60, "y": 200, "w": 60, "h": 60, "rotation": 0, "opacity": 1 } } },
    { "id": "target1", "sceneId": "s1", "kind": "circle", "visible": true, "layer": 1, "components": { "Transform": { "x": 600, "y": 140, "w": 50, "h": 50, "rotation": 0, "opacity": 1 } } },
    { "id": "target2", "sceneId": "s1", "kind": "circle", "visible": true, "layer": 1, "components": { "Transform": { "x": 640, "y": 280, "w": 50, "h": 50, "rotation": 0, "opacity": 1 } } },
    { "id": "score_text", "sceneId": "s1", "kind": "text", "visible": true, "layer": 3, "components": { "Transform": { "x": 30, "y": 30, "w": 200, "h": 40 }, "Text": { "text": "امتیاز: ۰", "size": 24, "color": "#10B981" } } },
    { "id": "shoot_btn", "sceneId": "s1", "kind": "button", "visible": true, "layer": 3, "components": { "Transform": { "x": 620, "y": 380, "w": 140, "h": 60 }, "Button": { "label": "شلیک", "eventId": "ev_shoot", "enabled": true } } }
  ],
  "events": [
    { "id": "ev_shoot", "trigger": { "type": "tap", "target": "shoot_btn" }, "actions": [ { "capability": "CAP-0020", "params": { "variable": "score", "amount": 10 } } ] }
  ],
  "variables": [
    { "name": "score", "type": "number", "initial": 0 }
  ],
  "assets": []
}